{
  "schema": "fox.motion_strategy.v1",
  "version": 1,
  "provider": "apple_vision_2d",
  "coordinateSpace": "normalized_image_y_up_pixel_aspect_corrected",
  "preparationJoints": [
    "selected.shoulder",
    "selected.elbow"
  ],
  "recovery": {
    "shortGap": "retain_candidate_only_with_valid_continuity_guards",
    "timingAfterGap": "unmeasured",
    "longGap": "discard_unfinished_preserve_count"
  },
  "phase": {
    "kind": "visual_angular_return",
    "end": "counting_gate",
    "fullEccentricComparison": false,
    "publication": "same_cycle",
    "lastRepetition": "only_observed"
  },
  "parameters": {
    "configuration": "pose-counter-defaults.json",
    "runtime": "pose-runtime-defaults.json",
    "profile": "curl"
  },
  "id": "curl-side",
  "exercise": "curl",
  "algorithm": "curl_2d_v4",
  "bodyView": "side",
  "countingJoints": [
    "selected.shoulder",
    "selected.elbow",
    "selected.wrist"
  ],
  "alternativeGeometry": "none",
  "counting": {
    "commit": "completed_cycle",
    "terminal": "requires_return",
    "rangeMeaning": "counting_gate_not_form_score"
  },
  "limitations": [
    "Front-view occlusion is not supported.",
    "Wrist-only grace is conditional on stable visible shoulder and elbow; no missing peak is invented."
  ],
  "contractTests": [
    "MotionStrategyTests/testLegacyActionsDoNotCommitAtPeakAndKeepPhaseEvidenceAfterReturn",
    "PoseLiveR2Tests"
  ]
}
